{
  "schema": "CELLERATOR-CE-GEO-COMMAND/1",
  "campaign_id": "replace-with-task-and-candidate-campaign-id",
  "project_root": "/home/tumlinson/Cellerator",
  "commands": {
    "build": [["cmake", "--build", "build", "--target", "replace-target", "-j", "20"]],
    "correctness": [["./build/replace-correctness-target"]],
    "measure": [["./build/replace-benchmark-target", "--warmups", "3", "--repeats", "11"]]
  },
  "methodology": {
    "warmups": 3,
    "repeats": 11,
    "maximum_mad_percent": 5.0,
    "cold_warm_separated": true,
    "correctness_before_measurement": true
  },
  "resources": {
    "required_leases": ["benchmark", "gpu"],
    "benchmark_mutex": "bench/benchmark_mutex.hh",
    "run_without_leases": false
  },
  "capture": {
    "source": true,
    "device": true,
    "topology": true,
    "toolchain": true,
    "build": true
  },
  "required_phases": {
    "cold": ["host_preparation", "semantic_packing", "projection_construction", "backend_prepare", "static_value_pack", "persistent_upload"],
    "warm": ["dynamic_h2d", "dynamic_input_pack", "kernel", "residual", "epilogue", "order_transform", "synchronization", "communication", "d2h", "consumer_visible_complete"]
  }
}
